{
  "$schema": "https://raw.githubusercontent.com/johnlam1968/pi-voice-telegram/main/pi-voice-telegram.schema.json",
  "_hint": "pi-voice-telegram companion settings (v0.14.2+). Hot-reload is on — changes take effect on the next turn, no restart. TTS/STT defaults (tts.lang, tts.voice, tts.model, stt.lang, stt.baseUrl) live HERE, NOT in telegram.json. telegram.json controls the bridge (chat/polling/role access); THIS file controls the voice pipeline. See $schema for the full key reference.",
  "inbound": {
    "echoEnabled": true
  },
  "tools": {
    "enabled": false,
    "tts": {
      "enabled": true,
      "name": "synthesize_voice"
    },
    "stt": {
      "enabled": true,
      "name": "transcribe_audio"
    }
  },
  "tts": {
    "voice": "Cantonese_PlayfulMan",
    "lang": "Chinese,Yue",
    "model": "speech-2.8-hd",
    "timeoutMs": 30000
  },
  "stt": {
    "lang": "yue",
    "baseUrl": "http://127.0.0.1:8080",
    "timeoutMs": 60000
  }
}
